{
  "$schema": "https://json-schema.org/draft/2020-12/schema",
  "$id": "https://github.com/espigule/collinear-fractals-gpu/schemas/certificate.schema.json",
  "title": "Collinear Fractals GPU certificate",
  "type": "object",
  "required": [
    "schema_version",
    "software_version",
    "n",
    "N",
    "c",
    "k_max",
    "L_max",
    "verdict",
    "renderer",
    "proof_status",
    "limitations"
  ],
  "properties": {
    "schema_version": {
      "type": "string"
    },
    "software_version": {
      "type": "string"
    },
    "mode": {
      "type": "string"
    },
    "n": {
      "type": "integer",
      "minimum": 2
    },
    "N": {
      "type": "integer",
      "minimum": 3
    },
    "c": {
      "type": [
        "object",
        "null"
      ],
      "required": [
        "re",
        "im"
      ],
      "properties": {
        "re": {
          "type": "number"
        },
        "im": {
          "type": "number"
        }
      },
      "additionalProperties": true,
      "description": "Effective parameter used by the search. Null only when a reciprocal input exceeds finite numerical range; input_parameter preserves entered coordinates."
    },
    "k_max": {
      "type": "integer",
      "minimum": 0,
      "description": "Maximum inverse depth; zero tests only the initial point."
    },
    "L_max": {
      "type": "integer",
      "minimum": 1,
      "description": "Per-depth retained-frontier cap, not a total node budget."
    },
    "verdict": {
      "enum": [
        "Interior",
        "Interior-offLens",
        "Exterior",
        "Undetermined"
      ]
    },
    "word": {
      "type": "array",
      "items": {
        "type": "integer"
      }
    },
    "digits": {
      "type": "array",
      "items": {
        "type": "integer"
      }
    },
    "trap": {
      "type": [
        "object",
        "null"
      ]
    },
    "enclosure": {
      "type": [
        "object",
        "null"
      ]
    },
    "renderer": {
      "type": "string"
    },
    "visual_renderer": {
      "type": [
        "object",
        "null"
      ],
      "properties": {
        "renderer_mode": {
          "enum": [
            "boundary",
            "prefix",
            "histogram",
            "survival"
          ]
        },
        "requested_base_depth": {
          "type": "integer",
          "minimum": 0,
          "maximum": 100
        },
        "adaptive": {
          "type": "boolean"
        },
        "effective_depth": {
          "type": "integer",
          "minimum": 0,
          "maximum": 100
        },
        "pixel_radius_world": {
          "type": "number",
          "minimum": 0
        }
      },
      "additionalProperties": true,
      "description": "Optional visual-renderer metadata. This is not a proof field."
    },
    "parameter_view": {
      "type": "object",
      "properties": {
        "mode": {
          "enum": ["mn", "mn0", "mn1", "compare", "rn"]
        },
        "layers": {
          "type": "array",
          "items": { "enum": ["mn", "mn0", "mn1"] },
          "uniqueItems": true,
          "maxItems": 3,
          "description": "Independently selected aggregate layers. An empty selection is valid."
        },
        "digits": {
          "type": "array",
          "items": { "type": "integer" },
          "uniqueItems": true,
          "description": "Selected first digits t in D_n. Every corresponding subset uses A_n for all later digits."
        },
        "search_record_set": {
          "const": "M_n"
        },
        "escape_depth": {
          "type": "integer",
          "minimum": 0,
          "maximum": 100
        },
        "work_limit": {
          "type": "integer",
          "minimum": 1
        },
        "mn": { "type": ["object", "null"] },
        "mn0": { "type": ["object", "null"] },
        "mn1": { "type": ["object", "null"] },
        "digit_results": {
          "type": "object",
          "propertyNames": { "pattern": "^-?[0-9]+$" },
          "additionalProperties": { "type": "object" },
          "description": "Point-search results keyed by the selected integer first digit."
        },
        "raster_sampling": {
          "const": "parameter-cell"
        },
        "raster_visible": {
          "type": "boolean"
        },
        "raster_parameter_radius": {
          "type": ["number", "null"],
          "minimum": 0,
          "description": "Actual pixel-cell radius in the displayed parameter coordinates before reciprocal conversion. Null when the parameter canvas is hidden."
        },
        "selected_point_sampling": {
          "const": "point"
        },
        "finite_survival": { "type": "string" }
      },
      "additionalProperties": true,
      "description": "Independent layer selections and auxiliary point-search results, separate from parameter-cell image coverage and the main connectedness record."
    },
    "proof_status": {
      "enum": [
        "finite-search-certificate",
        "theorem-certified",
        "illustrative",
        "exploratory",
        "bounded-search-undetermined"
      ],
      "description": "Legacy status vocabulary. finite-search-certificate denotes a floating-point record, not an interval-verified proof."
    },
    "limitations": {
      "type": "string"
    },
    "stop_reason": {
      "enum": [
        "invalid-input",
        "outside-domain",
        "numerical-range",
        "enclosure-escape",
        "trap-hit",
        "tree-exhausted",
        "node-cap",
        "depth-cap",
        null
      ]
    },
    "tol": {
      "type": "number",
      "exclusiveMinimum": 0,
      "description": "Target for the unscaled enclosure-series tail; not a bound on all arithmetic error."
    },
    "depth": {
      "type": "integer",
      "minimum": 0
    },
    "arithmetic": {
      "type": [
        "string",
        "object"
      ],
      "description": "Arithmetic provenance; finite-search verdicts are not interval-verified by this schema."
    },
    "nodes_explored": {
      "type": "integer",
      "minimum": 0
    },
    "input_parameter": {
      "type": "object",
      "required": [
        "re",
        "im"
      ],
      "properties": {
        "re": {
          "type": "number"
        },
        "im": {
          "type": "number"
        }
      },
      "additionalProperties": true
    },
    "effective_c": {
      "type": [
        "object",
        "null"
      ],
      "description": "Expanding parameter used by the search after any reciprocal normalization."
    },
    "parameter_convention": {
      "enum": [
        "expanding-parameter",
        "reciprocal-input"
      ]
    },
    "in_lens": {
      "type": "boolean"
    },
    "trap_region": {
      "type": [
        "string",
        "null"
      ]
    }
  },
  "additionalProperties": true,
  "description": "Floating-point finite-search record. Schema validity does not verify the mathematical result.",
  "allOf": [
    {
      "if": {
        "properties": {
          "c": {
            "type": "null"
          }
        },
        "required": [
          "c"
        ]
      },
      "then": {
        "properties": {
          "verdict": {
            "const": "Undetermined"
          },
          "stop_reason": {
            "const": "numerical-range"
          }
        },
        "required": [
          "input_parameter",
          "stop_reason"
        ]
      }
    }
  ]
}
